Question,Answer,rag_answer,score
What are the latest trends in JavaScript frameworks?,"Your data doesn't contain specific discussions about JavaScript frameworks. However, there's discussion about web development with SVG animations and concerns about developers reaching for Lottie instead of learning CSS and SVG-based animations.","Based on the provided context, there is no direct mention of the latest trends in JavaScript frameworks. However, one of the comments (Comment ID: 44081926) mentions TargetJS, which seems to be a new framework for unifying UI development, but it doesn't specifically discuss JavaScript trends.

If you're looking for information on the latest trends in JavaScript frameworks, I'd recommend searching Hacker News or other relevant sources for more recent discussions and updates.",0.2312
How is Rust being adopted in production environments?,No specific content about Rust adoption found in your dataset.,"Based on the provided context, there is no direct information about Rust's adoption in production environments. However, one of the comments (Document 129) mentions that the author initially intended to reimplement the rotary phone dial driver in Rust to explore the state of the Rust for Linux project. Unfortunately, they soon realized that the necessary bindings simply are not available yet, so that part will have to wait.

This implies that Rust is being considered or explored as an option for certain projects, but there is no concrete information about its adoption in production environments.",0.2746
What are developers saying about TypeScript vs JavaScript performance?,"Your data includes one mention of TypeScript in the context of Claude Code usage: ""I find I am correcting it and re-prompting it as much as I didn't with 3.7 on a typescript codebase.""","Based on the provided context, there is no direct discussion about TypeScript vs JavaScript performance. However, some comments mention the performance of specific tools or libraries.

* In Document 655, uwemaurer mentions that es-toolkit is fully in Typescript and doesn't see significant improvements in performance.
* In Document 641, nodewrangler discusses the challenges of updating packages and migrating from one to another, but doesn't specifically compare TypeScript vs JavaScript performance.

There is no mention of a direct comparison between TypeScript and JavaScript performance.",0.3331
Which programming languages are trending on HackerNews?,"From your data, Go is mentioned in discussions about Claude Code development, and there's one reference to TypeScript. There's also discussion about programming keyboards with ""Programming on 34 Keys (2022)"".","Based on the provided context, there is no specific information about trending programming languages on Hacker News. The stories and comments do not mention any particular programming languages. Therefore, I cannot provide an answer to this question based on the given documents.",0.2582
What's the latest news about Claude 4?,"Extensive coverage! Your data shows Claude 4 was released with a system card, training cutoff date of March 2025 (latest among recent models). Users report mixed experiences - some praise it, others report issues with Claude Code tool calls failing 70-80% of the time.","According to the provided context, the latest training cutoff date for Claude 4 is March 2025. This information was not mentioned in the original announcement (Story ID: 44063703) but was pointed out by minimaxir in a comment (Comment ID: 44064231).",0.2858
How are developers using AI coding assistants?,"Your data shows significant discussion about Claude Code, GitHub Copilot, and Cursor. Developers report varying experiences - some find them helpful for greenfield projects, others struggle with accuracy.","Based on the provided context, there isn't a direct answer to this question. However, we can extract some relevant information from the comments.

* In Comment 44065362 (max_on_hn), the author mentions their headless coding agents product, which allows for multiple tasks in parallel and has already shown success with simple/routine features.
* In Comment 44053168 (spiffytech), the author discusses the potential job market implications of AI, but doesn't specifically mention developers using AI coding assistants.

It appears that there isn't a clear answer to this question within the provided context.",0.0786
What are people's thoughts on ChatGPT vs other AI models?,Users in your data compare Claude favorably to Gemini models. There's discussion about Claude 4's training cutoff being more recent than Gemini 2.5 (March 2025 vs January 2025).,"Based on the provided context, here are some key points about people's thoughts on ChatGPT vs other AI models:

* Some users consider ChatGPT a better language learning tool than Duolingo's hand-crafted app (Document 558).
* Others believe that while ChatGPT is impressive, it's not necessarily a game-changer compared to other AI models, as they tend to reach parity within 6 months (Document 511).
* There is also a discussion about the pace of AI development, with some users noting that waiting for even a few months can result in significant improvements (Documents 511 and 513).

Overall, it seems that people have mixed opinions on ChatGPT's capabilities compared to other AI models. While some see it as a valuable tool, others view it as just one part of the larger AI landscape.",0.1498
Are there concerns about AI replacing programmers?,"Your data includes philosophical discussions about LLMs potentially exceeding current capabilities and concerns about AI being used for ""agentic scenarios"" in coding environments.","Yes, there are concerns about AI replacing programmers. Some comments on Hacker News express worries that AI will replace human software engineers, especially for tasks that can be automated. For example:

* rco8786 (Document 148): ""The narrative is that AI is already replacing human software engineers.""
* spiffytech (Document 125): ""People who make strong use of it get first pick of the good jobs. People not making effective use of AI get whatever's left.""

However, others believe that AI will augment human capabilities rather than replace them. For instance:

* ZekeV (Document 125): ""AI is doing it at a scale we’ve never seen before... It’s where intelligence stops being a tool and starts becoming the environment — the ecosystem — that we operate in.""
* bwfan123 (Document 86): ""For experienced engineers, I see a great future fixing the shit show that is AI-code.""

The question of whether AI will replace programmers or not remains open.",0.1933
What startup ideas are getting attention on Show HN?,"Your data shows ""Show HN: SVG Animation Software"" (Expressive Animator) which helps create animated icons, logos, and illustrations with exports to Lottie, GIF, PNG, and video formats.","Based on the provided context, I found two startup ideas that got attention on Show HN:

* jmp (Story ID: 44088823) - Self-hosted bangs and go links
* Expressive Animator (Story ID: 44087049) - SVG vector animation software

Both of these stories have a score above 2 points, indicating some level of interest from the Hacker News community.",0.2089
How are startups approaching remote work?,"Limited specific content about startups and remote work, though there are discussions about development environments and WSL for remote development scenarios.","Based on the provided context, there is no direct answer to the question ""How are startups approaching remote work?"" However, some relevant comments can be extracted:

* madisp's comment mentions separating personal and company work, using a personal laptop, and avoiding working during work hours.
* ttd's comment discusses business options for a software business, including supporting its own development while helping customers feel like they're getting their money's worth.

These comments do not specifically address remote work, but they may provide some insights on how to approach work-life separation and business strategies.",0.3196
What's the current state of venture capital funding?,No specific VC funding discussions found in your dataset.,"Based on the provided context, there is no direct information about the current state of venture capital funding. The documents appear to be a mix of comments and user profiles from Hacker News, but none of them specifically discuss venture capital funding. Therefore, I would say that there is no relevant information available to answer this question.",0.1446
Which business models are working for SaaS companies?,There's discussion about subscription vs. lifetime license models in the context of the SVG animation software.,"Based on the provided context, it seems that there is no direct answer to the question about which business models are working for SaaS companies. However, we can extract some insights from the comments:

* One possible approach is to focus on artisanal, customized models (Comment ID: 44081330).
* Another option is to invest in high-level architectural skills and position yourself as a strategic advisor or architect (Comment ID: 44081330).
* It's also mentioned that subscription-based models may not be appealing to customers, so alternative revenue streams might be explored (Comment ID: 44087871).

It's worth noting that these comments are not specifically about SaaS companies, but rather provide general insights on the future of AI and software development. A more comprehensive answer would require additional context or specific data on successful SaaS business models.",0.2897
What skills should developers focus on in 2025?,"Your data suggests focusing on AI tool integration, with discussions about Claude Code, GitHub Copilot, and learning how to work effectively with AI coding assistants.","Based on the provided context, here are some key takeaways:

* marcosdumay (Document 129) suggests that using LLMs will become a commodity, and developers should focus on integrating them into agentic systems.
* spiffytech (Document 125) proposes that AI will be a superpower in skilled hands, bifurcating the job market. Developers who make strong use of AI will get first pick of good jobs.
* jillesvangurp (Document 79714) advises developers to focus on using LLMs and integrating them into agentic systems, understanding APIs, limitations, and different use cases.

In summary, developers in 2025 should focus on:

* Integrating Large Language Models (LLMs) into agentic systems
* Understanding APIs, limitations, and different use cases of LLMs
* Developing skills to effectively utilize AI as a superpower

These skills will be essential for success in the job market, especially with the increasing importance of AI in various industries.",0.2235
How is the job market for software engineers?,No specific job market discussions found in your dataset.,"Based on the provided context, it appears that AI/ML salaries are higher than regular dev salaries, indicating a strong demand for skilled professionals in this field. Additionally, Comment 44053168 suggests that the job market may bifurcate around AI, with those who effectively utilize it getting first pick of good jobs, while others may be left with fewer opportunities. Overall, the job market for software engineers seems to be favorable, with a high demand for skilled professionals in AI/ML.",0.1811
What are good practices for technical interviews?,No specific technical interview content found in your dataset.,"Based on the provided context, here are some good practices for technical interviews:

* **Prepare a coding test**: As mentioned in Document 47, it takes effort to conduct an interview properly. Prepare a coding test that specifically tests the candidate's skills and abilities.
* **Focus on relevant skills**: As mentioned in Document 590, having a solid understanding of the layer below where you're working is important. Focus on testing the candidate's skills and knowledge relevant to the position.
* **Invest time in learning AI/LLMs**: If you want to work with AI/LLMs, invest time in learning their internals. This can be beneficial for both personal and professional growth (Document 47).
* **Treat AI as a tool**: Alternatively, treat AI/LLMs as just another tool in your toolbox, like building polished web apps (Document 29).

These practices are based on the discussions and experiences shared by users on Hacker News.",0.1507
How do developers feel about WSL vs native Linux?,"Extensive discussion! Mixed opinions: Some love WSL, others prefer native Linux. Common WSL issues mentioned: networking problems, VPN issues, XServer problems, slower I/O, graphics issues.","Based on the provided context, here are some key points:

* GuB-42 uses both WSL and Linux daily and finds that while WSL is great for running Linux software on supported hardware, it's not as powerful as native Linux. They mention that WSL has I/O, graphics, and memory management issues compared to Linux.
* elif (author of the original comment) thinks WSL is more powerful than Linux because of its ease of use in running multiple OS instances simultaneously.

Overall, developers seem to have mixed opinions about WSL vs native Linux. While some appreciate the convenience and flexibility of WSL, others prefer the performance and reliability of native Linux.",0.3479
What interesting projects have been shared recently?,"""Show HN: SVG Animation Software"" - Expressive Animator for creating animated icons, logos, and illustrations with various export formats.","According to the provided context, an interesting project that has been shared recently is ""Show HN: SVG Animation Software"" (Story ID: 44087049) with a score of 56-62 points. This project allows users to create and export animated icons, logos, and illustrations using SVG vector animation software called Expressive Animator.",0.5432
Are there any new developer tools being showcased?,The SVG animation software and TargetJS are the main developer tools shown.,"Yes, there is a new developer tool being showcased. The story ""TargetJS: Unifying UI Dev – Animations, State, APIs"" (Story ID: 44087981) presents a new tool for unifying UI development, animations, state, and APIs.",0.1871
What open source projects are gaining traction?,Discussion mentions Synfig as an open-source alternative to commercial animation software.,"Based on the provided context, it appears that the Windows Subsystem for Linux is gaining traction as an open-source project. The story has a score of 1605 points and 78 comments, indicating significant interest and engagement from the Hacker News community. Additionally, the comment by max_on_hn suggests that there may be opportunities for affordable coding agents to contribute to open-source projects like this one.",0.1866
What are the most upvoted stories today?,"Claude 4 System Card (275 points), SVG Animation Software (56 points) are among the top stories.","Based on the provided context, the top 3 most upvoted stories today are:

* Claude 4 (Score: 1980 points)
* Spaced repetition systems have gotten better (Score: 1022 points)
* Watching AI drive Microsoft employees insane (Score: 1055 points)

Note that these scores are based on the provided documents and may not reflect the current upvote count.",0.4067
How do people discover new technologies on HackerNews?,No specific content about discovery methods found in your dataset.,"Based on the provided context, here's a concise answer:

People can discover new technologies on Hacker News through various means:

* **New stories**: Users can find new technology-related posts in the ""new"" category, such as Document 44088673 (""The Future of Software (AIOS)"") or Document 44088148 (""RedAPPLe"").
* **Top stories**: Popular and highly-discussed topics are featured in the ""topstories"" category, like Document 44087916 ('Strange metals' point to a whole new way to understand electricity).
* **Best stories**: The ""best"" category showcases top-rated posts, including Document 44044043 (Veo 3 and Imagen 4, and a new tool for filmmaking called Flow), which has garnered significant attention.
* **Ask HN**: Users can also discover new technologies through discussions in the ""ask_hn"" category, such as Document 31 (Ask HN: What HN posts inspired or changed your perspective the most?), where users share their experiences and insights.

These categories and features provide various entry points for users to discover new technologies on Hacker News.",0.0636
What's trending in the tech industry right now?,"AI/LLM developments (particularly Claude 4), development tools, and animation/graphics software appear to be trending topics.","Based on the provided context, it appears that the trend in the tech industry right now is the rapid advancement and commoditization of Large Language Models (LLMs). The comments mention the pace at which these models are improving, with some even suggesting that they will reach parity within 3-6 months. Additionally, there is a focus on the value-add of LLMs beyond just increased intelligence, such as improved tool calls and structured output.

The trend towards commoditization is also highlighted, with Google's competitive pricing wars and local companies deploying open LLM models. This has led to speculation that the market angle for LLMs will shift from general-purpose AI to artisanal customized models optimized for specific business use cases.

Overall, it seems that the tech industry is currently focused on the rapid development and application of LLMs, with a emphasis on their potential to revolutionize various industries.",0.1084
Are there discussions about work-life balance?,No specific work-life balance discussions found in your dataset.,"Yes, there are discussions about work-life balance. Specifically:

* Document 1226 mentions ""jobs for seniors"" that only become available to you after you turn 60, which could impact work-life balance.
* Document 1206 expresses concern about retiring when still healthy enough to do things (i.e., travel), implying a desire for a good work-life balance in retirement.

These comments suggest that the topic of work-life balance is relevant and being discussed on Hacker News.",0.3193
What programming conferences or events are being mentioned?,No specific conferences or events mentioned in your dataset.,"Based on the provided context, there are no programming conferences or events being mentioned. The stories and comments only discuss general topics such as programming, AI, and software development, but do not mention specific conferences or events.",0.4286
How do HackerNews users typically respond to controversial topics?,"Your data shows nuanced discussions, particularly around WSL vs Linux where users present multiple perspectives and acknowledge trade-offs.","Based on the provided context, HackerNews users typically respond to controversial topics by:

* Expressing their opinions and perspectives (e.g., tonyhart7's comment)
* Providing alternative viewpoints or counterarguments (e.g., jdiff's comment)
* Offering pragmatic advice or insights (e.g., wmeredith's comment)

Overall, the responses tend to be thoughtful, analytical, and respectful of differing opinions.",0.1111